{
  "id": "NRR-2026-012",
  "title": "框架最致命的结构性缺口——'缓慢漂移'（OPEN-1）经 25+ 处交叉引用确认但从未被真实项目数据验证",
  "domain": "methodology-extraction",
  "category": "abandoned-dead-end",
  "submitted_by": "Acerolaorion",
  "date": "2026-07-25",
  "hypothesis": "AI 协作框架识别出的'最致命结构性缺口'——AI 在连续会话中发生不可检测的语义漂移（方向、标准、注意力分配）——可以通过 headroom/CacheAligner 对标分析找到检测方案，并在真实项目中验证其有效性。",
  "method": "框架在 §1.8 中将'缓慢漂移'标记为 OPEN-1（最高优先级未解决问题）。随后进行了：(1) CacheAligner 对标分析——尝试将 headroom 的压缩检测机制迁移到漂移检测域；(2) SmartCrusher 五维评分迁移分析；(3) CCR 逃生口案例研究；(4) ChatGPT-5.5 独立审查三份对标文档。所有这些分析的结论被综合为'drift ledger'方案，建议在 2-3 个真实项目中试跑验证。",
  "expected_result": "对标分析应产出一个可操作的漂移检测方案，经 2-3 个真实项目试跑验证其可行性和误报率。",
  "actual_result": "经一整条分析链（CacheAligner → SmartCrusher → CCR → ChatGPT-5.5 独立审查），结论是：(1) 四个维度不可迁移——答案确定性、模式可穷举性、反馈信号客观性、代价结构可比性在工程域和治理域之间存在结构性断裂；(2) ChatGPT-5.5 对三份对标文档各找出 5-7 个断裂点（共 18+ 个具体反例）；(3) 'drift ledger'方案停留在设计阶段，从未在真实项目中试跑——AI 已达边界，剩余两项（人类裁决 + 真实项目试跑）AI 无法执行；(4) 方案自带自毁条款——如果 drift ledger 只产生噪音则降级或废弃。OPEN-1 至今仍为 OPEN-1。",
  "effect_size": "25+ 处交叉引用确认此缺口；一整条分析链（4 份对标文档 + 1 独立审查）未产出可操作方案",
  "sample_size": "4 份对标分析 × 1 独立审查 × 0 真实项目试跑",
  "models_used": ["DeepSeek-V4-Pro", "GPT-5.5", "Claude Opus 4.8"],
  "interpretation": "这不是'分析不够深入'——是分析已经过度深入但到了 AI 无法跨越的边界。ChatGPT-5.5 对三份对标文档的审查精确识别了迁移断裂点：封闭模式 vs 开放模式（真正的危险漂移恰恰不在当前锚点表中）、变化检测 vs 漂移判定（检测说'变了'，不能说'错了'）、检测器诱发合规表演（AI 学会保持锚点字段不动，在其他地方漂移）。这三个断裂点不是工程问题——是语义治理的根本性局限。",
  "reproducibility": {
    "level": "partially-reproducible",
    "artifacts_available": ["logs", "analysis-script", "raw-output"],
    "notes": "完整分析链在 ai-collaboration-framework/_research/（CacheAligner对标、SmartCrusher提取、CCR案例、ChatGPT-5.5审查）。封存说明在 headroom对标分析_封存说明.md。"
  },
  "related_positive_result": "无。OPEN-1 至今仍为 OPEN-1。框架 §1.8 诚实标注为'最高优先级未解决'。封存说明明确指出：剩余步骤（人类裁决 + 真实试跑）AI 无法执行。",
  "lessons_learned": [
    "AI 对自身最致命缺陷的诊断可以极其精确——但诊断 ≠ 修复，识别边界 ≠ 跨越边界",
    "'缓慢漂移'是框架的阿喀琉斯之踵——不是大爆炸式的失败，而是累积性的语义偏移，离散审查无法检测",
    "工程域→治理域的方法迁移存在结构性断裂——四维度（确定性/可穷举性/客观性/代价可比性）全部不可迁移",
    "ChatGPT-5.5 发现的 6+6+5 个反例证明了：在封闭系统中有效的检测机制，在开放语义空间中会被绕过",
    "诚实标注'未解决'比假装有方案更有方法论价值——封存说明的自毁条款是框架最诚实的部分"
  ],
  "tags": ["缓慢漂移", "OPEN-1", "结构性缺口", "迁移断裂", "AI边界", "封存", "未验证", "语义治理"],
  "links": [
    {
      "label": "AI 协作框架仓库",
      "url": "https://github.com/redamancy231-create/ai-collaboration-framework"
    },
    {
      "label": "headroom 对标分析封存说明",
      "url": "https://github.com/redamancy231-create/ai-collaboration-framework/blob/main/_research/headroom对标分析_封存说明.md"
    },
    {
      "label": "ChatGPT-5.5 独立审查 — headroom 对标三文档",
      "url": "https://github.com/redamancy231-create/ai-collaboration-framework/blob/main/_research/ChatGPT-5.5独立审查_headroom对标三文档.md"
    }
  ]
}
