{
  "id": "NRR-2026-004",
  "title": "mermaid-cli 渲染 PNG 不含 DPI 元数据，python-docx 默认 72 DPI 致图片 ~4 倍拉伸截断",
  "domain": "document-generation",
  "category": "methodology-failure",
  "submitted_by": "Acerolaorion",
  "date": "2026-06-23",
  "hypothesis": "mermaid-cli（mmdc）是 Mermaid 图表渲染的事实标准工具——预期其 PNG 输出在 python-docx → DOCX 管线中可直接嵌入使用，无需额外 DPI 后处理。",
  "method": "DOCX Pipeline 的 Mermaid→DOCX 管线（AI 辅助开发环境下发现）：Markdown 检测 Mermaid 代码块 → 按配置 DPI（默认 300）计算像素宽度 → mmdc --width <px> 渲染为 PNG → python-docx v1.2.0 add_picture() 嵌入 DOCX → Word 目视验证。",
  "expected_result": "PNG 以预期尺寸（约页面宽度 80-100%）嵌入 DOCX，Word 中正常显示。",
  "actual_result": "PNG 在 DOCX 中 ~4 倍拉伸。根因链：(1) mmdc 没有 --dpi 参数，--width 只控制渲染宽度，不写入 PNG pHYs chunk；(2) python-docx 对无 DPI 元数据的图片默认按 72 DPI 计算嵌入尺寸（非 Word 96 DPI——python-docx 写入显式 EMU 尺寸，Word 直接使用）；(3) 300 DPI 像素 ÷ 72 DPI = 物理尺寸膨胀 ~4.17×。",
  "effect_size": "物理尺寸膨胀 ~4.17×（300 DPI 像素 ÷ 72 DPI python-docx 默认值）",
  "sample_size": "所有含 Mermaid 图表的 DOCX 文档（项目初期 100% 复现）",
  "models_used": ["mermaid-cli (mmdc)", "python-docx v1.2.0", "Microsoft Word", "Pillow (修复)"],
  "interpretation": "工具链多层互操作契约中相邻环节的隐式假设不兼容。不是单点 bug：mmdc 正确渲染了指定宽度的像素，python-docx 正确按 72 DPI 默认值计算了嵌入尺寸。问题在工具之间缺少 DPI 注入步骤——管线设计者默认了'mmdc PNG 输出 = python-docx 可直接嵌入'。这是管线设计的方法论问题，非单个工具适用性问题。",
  "reproducibility": {
    "level": "partially-reproducible",
    "artifacts_available": ["code"],
    "notes": "可复现条件：mmdc + python-docx v1.2.0 + Pillow。python-docx 默认 DPI 行为(72)版本间一致，但 add_picture() 对 DPI 缺失图片的处理可能因版本而异。修复代码在 docx-pipeline 的 mermaid_renderer.py 中（_inject_dpi() 方法）。"
  },
  "related_positive_result": "修复成功。渲染后用 Pillow 读取 PNG → image.save(path, \"PNG\", dpi=(300,300)) 写入 pHYs chunk → python-docx 按 300 DPI 计算嵌入尺寸 → Word 中正确显示。",
  "lessons_learned": [
    "工具链每个环节须做端到端互操作假设校验——'A的输出=B的输入'的默认假设在每个新工具组合中都必须验证",
    "视觉验证不可跳过——纯代码审查检测不到 DPI 元数据缺失，必须打开 Word 目视确认最终渲染",
    "隐式默认值是集成 bug 温床——mmdc 不写 pHYs chunk 和 python-docx 72 DPI 各自合理，组合即 bug",
    "修复只需一行 Pillow 代码——但诊断靠目视发现，发现成本远高于修复成本"
  ],
  "tags": ["docx-pipeline", "mermaid-cli", "mmdc", "DPI", "PNG", "python-docx", "工具链互操作", "元数据", "端到端验证", "视觉bug"],
  "links": [
    {
      "label": "DOCX Pipeline 仓库",
      "url": "https://github.com/redamancy231-create/docx-pipeline"
    },
    {
      "label": "LLM 审查三类盲区（含渲染效果盲区）",
      "url": "https://github.com/redamancy231-create/methodology-handbook"
    }
  ]
}
