{
  "id": "NRR-2026-022",
  "title": "'提取者污染'——fork 作者附加的方法论文档被误归因到源项目，制造虚假方法论信号",
  "domain": "methodology-extraction",
  "category": "methodology-failure",
  "submitted_by": "Acerolaorion",
  "date": "2026-07-23",
  "hypothesis": "在对 fork 的源项目进行方法论提取时，fork 仓库中所有文件（含 CLAUDE.md、GitNexus 索引、分析报告）应反映源项目的方法论特征。预期这些附加文档能补充源项目的方法论信息。",
  "method": "对 NPGS（baopinshui/NPGS）进行完整方法论提取。该仓库被 fork 后，提取者（Acerolaorion）在其中添加了 CLAUDE.md、GitNexus 索引文件和独立分析报告，然后从 fork 仓库执行提取。事后追溯了哪些「方法论文档」来自源作者（baopinshui）、哪些来自 fork 提取者。",
  "expected_result": "至少部分附加文档应反映或补充源项目的方法论特征。",
  "actual_result": "NPGS 的 CLAUDE.md、GitNexus 索引、分析报告全部来自 fork 提取者。源项目（baopinshui）的方法论文档=0。这些附加文档反映的是提取者自己的方法论（DeepSeek-V4-Pro + GPT-5.6-Sol 审查），不是源项目的。如果不区分两者，提取者会把'自己编写的源项目唯一方法论文档'误归因为'源项目有方法论自觉'——制造虚假方法论信号。",
  "effect_size": "源项目方法论文档=0；fork 附加文档 100% 来自提取者",
  "sample_size": "1 个项目（NPGS）× 提取者附加文档 vs 源项目原生文档对比",
  "models_used": ["DeepSeek-V4-Pro", "GPT-5.6-Sol", "GitNexus"],
  "interpretation": "这不是 NPGS 的问题——是提取框架的 Phase 0 设计缺陷。当提取者也是 fork 仓库的唯一方法论文档贡献者时，框架的默认假设（'仓库中的方法论文档反映了源项目的方法论'）会系统性高估源项目的方法论自觉。Phase 0 需要增加'提取者污染'判别步骤——检查 CLAUDE.md/分析报告/GitNexus 索引的作者是否等于源项目作者，过滤掉提取者自己编写的文档。",
  "reproducibility": {
    "level": "partially-reproducible",
    "artifacts_available": ["logs", "analysis-script"],
    "notes": "第三方分析条目。NPGS 源仓库（baopinshui/NPGS）和 fork 仓库（redamancy231-create/NPGS）的差异可独立核查。提取者附加的 CLAUDE.md 和 GitNexus 索引在 fork 仓库中。"
  },
  "related_positive_result": "框架在 Phase 0 增加'提取者污染'判别后可避免此问题——检查方法论文档作者身份即可过滤。这不是框架结构性失败，是可修复的设计缺陷。",
  "lessons_learned": [
    "当提取者也是仓库中唯一方法论文档的作者时，这些文档反映的是提取者而非源项目——制造虚假方法论信号",
    "Phase 0 需要'提取者污染'判别——检查 CLAUDE.md/分析报告作者 ≠ 源项目作者时降权或排除",
    "fork 后添加的分析工件不应被当作源项目方法论的一部分——这是'观察者效应'在方法论提取中的体现",
    "源项目方法论文档=0 不应被解读为'无法提取'——它是诚实的信号，不是提取失败"
  ],
  "tags": ["提取者污染", "fork", "NPGS", "方法论归因", "Phase0缺陷", "虚假信号", "第三方分析"],
  "links": [
    {
      "label": "NPGS 源仓库 (baopinshui/NPGS)",
      "url": "https://github.com/baopinshui/NPGS"
    },
    {
      "label": "方法论提取方法论 — NPGS 证据卡",
      "url": "https://github.com/redamancy231-create/methodology-extraction-methodology/blob/main/explorations/evidence_card_npgs_external.md"
    }
  ]
}
